{
  "nodeId": "my.image.generate.basic.renderTarget",
  "creatorName": "my_RenderTarget",
  "family": "texture-output",
  "admission": "vuo",
  "ports": [
    { "id": "renderTick", "direction": "input", "type": "Event", "cardinality": "single", "eventFlow": "event" },
    { "id": "Command", "direction": "input", "type": "VuoList_VuoSceneObject", "cardinality": "single", "eventFlow": "data" },
    { "id": "ColorBuffer", "direction": "output", "type": "VuoImage", "cardinality": "single", "eventFlow": "data" },
    { "id": "DepthBuffer", "direction": "output", "type": "VuoImage", "cardinality": "single", "eventFlow": "data" }
  ],
  "params": [
    { "id": "Width", "type": "Integer", "default": 960, "range": { "min": 1, "max": 8192 }, "owner": "NodeSpec", "affects": "offscreenRenderSize", "safeToChangeLive": false, "saved": true },
    { "id": "Height", "type": "Integer", "default": 540, "range": { "min": 1, "max": 8192 }, "owner": "NodeSpec", "affects": "offscreenRenderSize", "safeToChangeLive": false, "saved": true }
  ],
  "state": "external-state",
  "color": { "role": "texture-output", "token": "ColorForTextures" },
  "flow": {
    "timeOwner": "my_MainClock",
    "frameOwner": "my_MainClock",
    "dirtyOwner": "runtimeGraph",
    "seedOwner": "none",
    "eventOrdering": "renderTick-then-sceneRenderToImage",
    "commandOwner": "commandGraph"
  },
  "backendPolicy": {
    "metal": "proof-only",
    "vuo": "host-layer-proof",
    "webgl": "disabled",
    "software": "fallback",
    "missingCapability": "diagnostic-visible"
  },
  "parity": { "tixl": "host-layer-proof", "vuo": "host-layer-proof" },
  "failureCodes": ["backend.capability.missing", "node.port.missing", "scheduler.event_order.unreplayable"],
  "observability": {
    "requiredContext": ["graphId", "frameId", "commandId", "nodeId", "backendId", "artifactPath", "diagnosticCode"]
  },
  "proof": {
    "id": "vuo_high_risk.renderTarget",
    "ownerLane": "vuo-high-risk-proof",
    "claims": ["vuoSceneRenderImageHostProof", "colorBufferVisible", "depthBufferVisible"],
    "nonclaims": ["tixlDx11RenderTargetParity", "textureViewSrvUavRtvParity", "nativeBackendHazardTracking"],
    "fixture": "docs/runtime/fixtures/creator_constant_blend_no_clock.graph.json",
    "script": "tests/vuo_high_risk_nodes.test.js",
    "artifacts": ["vuo-nodes/my.image.generate.basic.renderTarget.c", "vuo-compositions/myworld-high-risk-vuo-node-lab.vuo"],
    "tests": ["tests/vuo_high_risk_nodes.test.js", "tests/render_target_contract.test.js"],
    "freshness": {
      "generatedAt": "2026-06-06",
      "verificationCommand": "node --test tests/vuo_high_risk_nodes.test.js tests/render_target_contract.test.js",
      "expectedResult": "pass"
    },
    "observability": {
      "requiredContext": ["graphId", "frameId", "commandId", "nodeId", "backendId", "artifactPath", "diagnosticCode"]
    }
  }
}
